{
  "schemaVersion": "bearing.rail-fixture.v1",
  "domain": "rail",
  "layoutId": "Car 6, Business Class",
  "authoringSource": "independently_authored_synthetic",
  "bounds_m": {
    "length": 26.4,
    "width": 3.1
  },
  "car": {
    "quietCar": true
  },
  "seats": [
    {
      "ref": "6-7A",
      "row": 7,
      "seatLetter": "A",
      "position_m": {
        "x": 0.35,
        "y": 2
      },
      "side": "window",
      "facing": "backward",
      "price_usd": 72,
      "available": false,
      "wheelchairSpace": false,
      "transferSeat": false,
      "companionSeat": true,
      "movableArmrest": false,
      "footSpace_in2": 336,
      "bulkhead": true,
      "exitRow": false,
      "features": [
        "reading_light"
      ]
    },
    {
      "ref": "6-7B",
      "row": 7,
      "seatLetter": "B",
      "position_m": {
        "x": 1.05,
        "y": 2
      },
      "side": "aisle",
      "facing": "backward",
      "price_usd": 72,
      "available": true,
      "wheelchairSpace": true,
      "transferSeat": false,
      "companionSeat": false,
      "movableArmrest": true,
      "footSpace_in2": 336,
      "bulkhead": true,
      "exitRow": false,
      "features": [
        "reading_light"
      ]
    },
    {
      "ref": "6-7C",
      "row": 7,
      "seatLetter": "C",
      "position_m": {
        "x": 2.05,
        "y": 2
      },
      "side": "aisle",
      "facing": "backward",
      "price_usd": 72,
      "available": true,
      "wheelchairSpace": true,
      "transferSeat": false,
      "companionSeat": false,
      "movableArmrest": true,
      "footSpace_in2": 336,
      "bulkhead": true,
      "exitRow": false,
      "features": [
        "reading_light"
      ]
    },
    {
      "ref": "6-7D",
      "row": 7,
      "seatLetter": "D",
      "position_m": {
        "x": 2.75,
        "y": 2
      },
      "side": "window",
      "facing": "backward",
      "price_usd": 72,
      "available": true,
      "wheelchairSpace": false,
      "transferSeat": false,
      "companionSeat": true,
      "movableArmrest": false,
      "footSpace_in2": 336,
      "bulkhead": true,
      "exitRow": false,
      "features": [
        "reading_light"
      ]
    },
    {
      "ref": "6-8A",
      "row": 8,
      "seatLetter": "A",
      "position_m": {
        "x": 0.35,
        "y": 3.5
      },
      "side": "window",
      "facing": "forward",
      "price_usd": 76,
      "available": true,
      "wheelchairSpace": false,
      "transferSeat": false,
      "companionSeat": false,
      "movableArmrest": false,
      "footSpace_in2": 288,
      "bulkhead": false,
      "exitRow": false,
      "features": [
        "power_outlet",
        "reading_light"
      ]
    },
    {
      "ref": "6-8B",
      "row": 8,
      "seatLetter": "B",
      "position_m": {
        "x": 1.05,
        "y": 3.5
      },
      "side": "aisle",
      "facing": "forward",
      "price_usd": 76,
      "available": true,
      "wheelchairSpace": false,
      "transferSeat": true,
      "companionSeat": false,
      "movableArmrest": true,
      "footSpace_in2": 288,
      "bulkhead": false,
      "exitRow": false,
      "features": [
        "power_outlet",
        "reading_light"
      ]
    },
    {
      "ref": "6-8C",
      "row": 8,
      "seatLetter": "C",
      "position_m": {
        "x": 2.05,
        "y": 3.5
      },
      "side": "aisle",
      "facing": "forward",
      "price_usd": 76,
      "available": true,
      "wheelchairSpace": false,
      "transferSeat": true,
      "companionSeat": false,
      "movableArmrest": true,
      "footSpace_in2": 288,
      "bulkhead": false,
      "exitRow": false,
      "features": [
        "power_outlet",
        "reading_light"
      ]
    },
    {
      "ref": "6-8D",
      "row": 8,
      "seatLetter": "D",
      "position_m": {
        "x": 2.75,
        "y": 3.5
      },
      "side": "window",
      "facing": "forward",
      "price_usd": 76,
      "available": false,
      "wheelchairSpace": false,
      "transferSeat": false,
      "companionSeat": false,
      "movableArmrest": false,
      "footSpace_in2": 288,
      "bulkhead": false,
      "exitRow": false,
      "features": [
        "power_outlet",
        "reading_light"
      ]
    },
    {
      "ref": "6-9A",
      "row": 9,
      "seatLetter": "A",
      "position_m": {
        "x": 0.35,
        "y": 5
      },
      "side": "window",
      "facing": "forward",
      "price_usd": 80,
      "available": true,
      "wheelchairSpace": false,
      "transferSeat": false,
      "companionSeat": false,
      "movableArmrest": false,
      "footSpace_in2": 288,
      "bulkhead": false,
      "exitRow": false,
      "features": [
        "reading_light"
      ]
    },
    {
      "ref": "6-9B",
      "row": 9,
      "seatLetter": "B",
      "position_m": {
        "x": 1.05,
        "y": 5
      },
      "side": "aisle",
      "facing": "forward",
      "price_usd": 80,
      "available": false,
      "wheelchairSpace": false,
      "transferSeat": false,
      "companionSeat": false,
      "movableArmrest": true,
      "footSpace_in2": 288,
      "bulkhead": false,
      "exitRow": false,
      "features": [
        "reading_light"
      ]
    },
    {
      "ref": "6-9C",
      "row": 9,
      "seatLetter": "C",
      "position_m": {
        "x": 2.05,
        "y": 5
      },
      "side": "aisle",
      "facing": "forward",
      "price_usd": 80,
      "available": true,
      "wheelchairSpace": false,
      "transferSeat": false,
      "companionSeat": false,
      "movableArmrest": true,
      "footSpace_in2": 288,
      "bulkhead": false,
      "exitRow": false,
      "features": [
        "reading_light"
      ]
    },
    {
      "ref": "6-9D",
      "row": 9,
      "seatLetter": "D",
      "position_m": {
        "x": 2.75,
        "y": 5
      },
      "side": "window",
      "facing": "forward",
      "price_usd": 80,
      "available": true,
      "wheelchairSpace": false,
      "transferSeat": false,
      "companionSeat": false,
      "movableArmrest": false,
      "footSpace_in2": 288,
      "bulkhead": false,
      "exitRow": false,
      "features": [
        "reading_light"
      ]
    },
    {
      "ref": "6-10A",
      "row": 10,
      "seatLetter": "A",
      "position_m": {
        "x": 0.35,
        "y": 6.5
      },
      "side": "window",
      "facing": "backward",
      "price_usd": 64,
      "available": true,
      "wheelchairSpace": false,
      "transferSeat": false,
      "companionSeat": false,
      "movableArmrest": false,
      "footSpace_in2": 288,
      "bulkhead": false,
      "exitRow": false,
      "features": [
        "power_outlet",
        "reading_light"
      ]
    },
    {
      "ref": "6-10B",
      "row": 10,
      "seatLetter": "B",
      "position_m": {
        "x": 1.05,
        "y": 6.5
      },
      "side": "aisle",
      "facing": "backward",
      "price_usd": 64,
      "available": true,
      "wheelchairSpace": false,
      "transferSeat": false,
      "companionSeat": false,
      "movableArmrest": true,
      "footSpace_in2": 288,
      "bulkhead": false,
      "exitRow": false,
      "features": [
        "power_outlet",
        "reading_light"
      ]
    },
    {
      "ref": "6-10C",
      "row": 10,
      "seatLetter": "C",
      "position_m": {
        "x": 2.05,
        "y": 6.5
      },
      "side": "aisle",
      "facing": "backward",
      "price_usd": 64,
      "available": false,
      "wheelchairSpace": false,
      "transferSeat": false,
      "companionSeat": false,
      "movableArmrest": true,
      "footSpace_in2": 288,
      "bulkhead": false,
      "exitRow": false,
      "features": [
        "power_outlet",
        "reading_light"
      ]
    },
    {
      "ref": "6-10D",
      "row": 10,
      "seatLetter": "D",
      "position_m": {
        "x": 2.75,
        "y": 6.5
      },
      "side": "window",
      "facing": "backward",
      "price_usd": 64,
      "available": true,
      "wheelchairSpace": false,
      "transferSeat": false,
      "companionSeat": false,
      "movableArmrest": false,
      "footSpace_in2": 288,
      "bulkhead": false,
      "exitRow": false,
      "features": [
        "power_outlet",
        "reading_light"
      ]
    },
    {
      "ref": "6-11A",
      "row": 11,
      "seatLetter": "A",
      "position_m": {
        "x": 0.35,
        "y": 8
      },
      "side": "window",
      "facing": "backward",
      "price_usd": 68,
      "available": false,
      "wheelchairSpace": false,
      "transferSeat": false,
      "companionSeat": false,
      "movableArmrest": false,
      "footSpace_in2": 288,
      "bulkhead": false,
      "exitRow": false,
      "features": [
        "reading_light"
      ]
    },
    {
      "ref": "6-11B",
      "row": 11,
      "seatLetter": "B",
      "position_m": {
        "x": 1.05,
        "y": 8
      },
      "side": "aisle",
      "facing": "backward",
      "price_usd": 68,
      "available": true,
      "wheelchairSpace": false,
      "transferSeat": false,
      "companionSeat": false,
      "movableArmrest": true,
      "footSpace_in2": 288,
      "bulkhead": false,
      "exitRow": false,
      "features": [
        "reading_light"
      ]
    },
    {
      "ref": "6-11C",
      "row": 11,
      "seatLetter": "C",
      "position_m": {
        "x": 2.05,
        "y": 8
      },
      "side": "aisle",
      "facing": "backward",
      "price_usd": 68,
      "available": true,
      "wheelchairSpace": false,
      "transferSeat": false,
      "companionSeat": false,
      "movableArmrest": true,
      "footSpace_in2": 288,
      "bulkhead": false,
      "exitRow": false,
      "features": [
        "reading_light"
      ]
    },
    {
      "ref": "6-11D",
      "row": 11,
      "seatLetter": "D",
      "position_m": {
        "x": 2.75,
        "y": 8
      },
      "side": "window",
      "facing": "backward",
      "price_usd": 68,